"Title","Closing Wisdom","Cosmic Weather Report","Energy Type","Featured Events","Practical Suggestions","Reading Date","Real World Translation","What This Means For You"
"July 1, 2026 - Abundant Healing Tension","Jupiter square Chiron reminds us that true abundance requires healing wisdom, not just confidence. Today, let challenges deepen your leadership.","Jupiter square Chiron at 10:24 PM + Void Moon in Aquarius (6:51 AM - 2:33 PM) - abundant leadership meets healing challenges while your inner humanitarian gets processing time. Growth meets wisdom through productive friction.","Transformation","Jupiter square Chiron (10:24 PM), Void Moon in Aquarius (6:51 AM - 2:33 PM)","• During void period (6:51 AM - 2:33 PM), avoid making major community commitments | • Use any leadership challenges or abundance blocks as opportunities to develop deeper healing wisdom | • Trust that friction between confidence and healing serves your authentic development | • After the void, apply community-minded approaches to abundance and creative leadership | • Focus on leadership that serves both personal growth and collective healing","2026-07-01","You know that feeling when your expanding creative leadership abilities meet some healing challenges that help you refine and strengthen your approach? That's Jupiter square Chiron creating productive tension. Your abundant confidence is learning deeper wisdom.","This aspect creates productive friction between your emerging abundant leadership abilities (Jupiter in Leo) and deeper healing wisdom (Chiron in Taurus), helping you develop more authentic and sustainable approaches to creative expression and abundant living."
"July 2, 2026 - Community Leadership Integration","Aquarius Moon reminds us that the most powerful individual leadership serves collective healing. Today, let your abundance become community medicine.","Moon in Aquarius continues after void, creating humanitarian energy perfect for integrating abundant leadership with healing wisdom through community-focused innovation and collective service.","Integration","Moon in Aquarius continues","• Apply your emerging abundant leadership abilities to community healing and humanitarian service | • Use creative confidence to pioneer innovative approaches to collective challenges | • Connect with communities that appreciate both leadership and healing wisdom | • Focus on abundance approaches that serve collective upliftment rather than just personal success | • Trust that your individual creative leadership serves humanity's evolution","2026-07-02","You know those days when your growing creative confidence wants to serve something bigger than personal success, when your abundant leadership abilities naturally flow toward community healing and collective benefit? That's Aquarius Moon supporting your Jupiter-Chiron integration.","This is perfect energy for channeling your abundant creative leadership toward community service, humanitarian causes, or innovative approaches that serve both personal healing and collective wellbeing."
"July 3, 2026 - Leadership Destiny Adjustment","Jupiter quincunx Node during spiritual processing helps leadership align with destiny. Today, let intuition adjust your abundant confidence.","Jupiter quincunx True Node at 8:24 AM + Extended Void Moon in Pisces (12:27 PM today - 1:30 AM tomorrow) - abundant leadership meets karmic adjustment while your inner mystic gets extended processing time.","Integration","Jupiter quincunx True Node (8:24 AM), Extended Void Moon in Pisces begins (12:27 PM)","• During void period (12:27 PM today - 1:30 AM tomorrow), avoid making major spiritual or creative decisions | • Use this time to feel into how your abundant leadership can better serve your soul's purpose | • Consider what adjustments would align your creative confidence with spiritual wisdom | • Let intuition guide understanding of what authentic leadership means for your evolutionary path | • Trust that small adjustments create better alignment between abundance and spiritual purpose","2026-07-03","You know that feeling when your growing creative leadership needs some fine-tuning to better align with your soul's evolutionary path? That's Jupiter quincunx Node creating helpful adjustment energy during extended spiritual processing.","This aspect creates opportunity for fine-tuning your abundant leadership approach to better serve your soul's evolutionary purpose, while the extended Pisces void Moon gives you time to feel into what authentic spiritual leadership looks like."
"July 4, 2026 - Spiritual Leadership Flow","Extended Pisces processing during leadership development ensures confidence serves compassion. Today, let spirit organize your abundance.","Extended Void Moon in Pisces continues until 1:30 AM - continued spiritual processing of abundant leadership and karmic alignment, ensuring creative confidence serves spiritual wisdom and collective healing.","Integration","Extended Void Moon in Pisces continues (until 1:30 AM)","• Continue void period until 1:30 AM - perfect time for spiritual leadership processing | • Use this time for practices that connect creative confidence with spiritual purpose | • Pay attention to intuitive insights about how leadership can serve healing | • After the void, begin applying spiritually-aligned approaches to abundant leadership | • Trust that extended spiritual processing creates foundation for authentic leadership","2026-07-04","You know those extended periods when you need unstructured spiritual processing time to really understand how your creative leadership can serve your highest purpose? That's what this continued Pisces void Moon provides. Your abundant confidence is getting spiritual organization.","This continued void Moon provides additional space for integrating abundant leadership with spiritual wisdom, ensuring your creative confidence serves both personal evolution and collective healing."
"July 5, 2026 - Compassionate Leadership","Pisces Moon reminds us that the most powerful leadership flows from love and spiritual wisdom. Today, let compassion guide your confidence.","Moon in Pisces continues after extended void, creating flowing, compassionate energy perfect for expressing abundant leadership through spiritual wisdom and emotionally intelligent service.","Integration","Moon in Pisces continues","• Express your creative leadership through compassionate, spiritually-aligned action | • Use abundant confidence to serve healing and community wellbeing | • Let emotional intelligence and spiritual wisdom guide your approach to leadership | • Focus on abundance that flows from love and service rather than ego or competition | • Trust that spiritually-aligned leadership multiplies abundance for everyone involved","2026-07-05","You know those days when your creative confidence flows naturally from spiritual wisdom and emotional intelligence, when your leadership becomes a form of compassionate service? That's Pisces Moon supporting your abundant leadership with heart-centered flow.","This is perfect energy for expressing your abundant creative leadership through compassionate action, spiritual service, and emotionally intelligent approaches that serve both healing and community upliftment."
"July 6, 2026 - Pioneer Leadership Processing","Extended Aries void Moons are cosmic leadership boot camps. Today begins comprehensive training in conscious courage.","Extended Void Moon in Aries (12:21 AM today - 10:07 AM tomorrow) - your inner warrior gets over 22 hours to process how to channel abundant leadership and compassionate service into courageous, pioneering action.","Void","Extended Void Moon in Aries begins (12:21 AM)","• During void period (12:21 AM today - 10:07 AM tomorrow), avoid aggressive or impulsive leadership moves | • Use this time to feel deeply into what courageous leadership looks like when aligned with spiritual wisdom | • Consider how your abundant confidence can pioneer positive change through brave, compassionate action | • Let spiritual intelligence guide what deserves your warrior leadership energy | • Trust that conscious courage serves healing better than reactive leadership","2026-07-06","You know those times when you want to take bold leadership action but need extended processing time to ensure your courage serves compassion and wisdom? That's what this marathon Aries void Moon provides. Your leadership is getting courage training.","This extended void Moon creates unprecedented space for ensuring your abundant leadership and compassionate service translate into courageous action that truly serves growth, healing, and positive change."
"July 7, 2026 - Spiritual Revolution + Pioneer Release","When spiritual revolution meets pioneer release during leadership training, authentic courage emerges. Today, let internal wisdom guide release.","Neptune Retrograde at 6:54 AM + Last Quarter Moon in Aries at 3:29 PM + Void Moon continues until 10:07 AM - spiritual vision shifts inward, pioneer release activation, all during extended courage processing. Transformation meets innovation.","Release","Neptune Retrograde (6:54 AM), Last Quarter Moon in Aries (3:29 PM), Void Moon continues (until 10:07 AM)","• Continue void period until 10:07 AM - extended leadership processing continues | • Use Neptune retrograde period to focus on internal spiritual development rather than external inspiration | • Identify which leadership patterns or pioneer approaches you're ready to release | • After void period, take action to consciously release what no longer serves authentic leadership | • Trust that internal spiritual work and conscious release serve better leadership later","2026-07-07","You know those intense days when spiritual inspiration shifts focus to internal processing, you're ready to release outdated pioneer patterns, and everything happens during extended leadership training? That's today's powerful combination.","Neptune retrograde begins a period of internal spiritual processing, the Last Quarter Moon creates opportunity to release outdated leadership patterns, and the ongoing void Moon gives you time to integrate all these shifts."
"July 8, 2026 - Grounded Leadership","Taurus Moon reminds us that the most powerful leadership creates lasting abundance and security. Today, ground your courage in practical prosperity.","Brief Void Moon in Taurus (1:41 PM - 3:30 PM), then Moon in Taurus - a short abundance processing pause followed by sustainable leadership building. Your pioneer courage wants earth-based foundations.","Integration","Brief Void Moon in Taurus (1:41 PM - 3:30 PM), Moon in Taurus","• Brief void period (1:41-3:30 PM) - pause before making abundance commitments | • After void, build sustainable foundations under your abundant leadership and courageous service approaches | • Focus on leadership that creates lasting value and practical abundance for all involved | • Use earth-based wisdom to ground spiritual insights in tangible results | • Trust that slow, steady building serves authentic leadership better than dramatic gestures","2026-07-08","You know that feeling when courageous leadership insights suddenly want to become practical, sustainable approaches that create lasting abundance and security? That's Taurus Moon arriving after Aries release work. Your leadership wants to build lasting value.","Today brings perfect energy for grounding your leadership insights in practical, sustainable approaches that create lasting abundance, security, and tangible positive change."
"July 9, 2026 - Heart Service Refinement","Venus in Virgo reminds us that love becomes most powerful through devoted service and refined assistance. Today, let your heart serve through skillful help.","Venus enters Virgo at 1:22 PM - your cosmic heart just moved into the service zone, like your love and values getting infused with analytical precision and devotional service orientation.","Activation","Venus enters Virgo (1:22 PM)","• Express love and values through helpful, practical service and skilled assistance | • Refine your approaches to creativity, relationships, and abundance to better serve others | • Use analytical abilities to perfect your expressions of love and leadership | • Focus on values that combine personal fulfillment with genuine service to others | • Trust that devoted service to meaningful details expresses love as powerfully as grand gestures","2026-07-09","You know that feeling when your heart suddenly wants to express love through helpful, precise service and devoted attention to meaningful details? That's Venus in Virgo beginning. Your love becomes practical devotion and refined assistance.","This transit shifts your approach to love, creativity, and values toward more service-oriented, analytically precise, and devotionally helpful expressions. Your heart wants to serve through skilled assistance and refined attention to what truly helps."
"July 10, 2026 - Healing Destiny Harmony","Node sextile Chiron during communication processing ensures healing serves destiny. Today, let wisdom organize your voice.","True Node sextile Chiron at 5:50 PM + Extended Void Moon in Gemini (5:13 AM - 5:41 PM) - soul purpose harmoniously supports healing work while your inner communicator gets extended processing time.","Integration","True Node sextile Chiron (5:50 PM), Extended Void Moon in Gemini (5:13 AM - 5:41 PM)","• During void period (5:13 AM - 5:41 PM), avoid making major communication commitments | • Use this time to explore how your healing wisdom serves your soul's evolutionary purpose | • Consider how to communicate healing insights in ways that serve both learning and growth | • After the void, begin sharing healing wisdom through multiple communication channels | • Trust that your personal healing work serves your destined contribution to collective growth","2026-07-10","You know that feeling when your life's purpose and your healing abilities work together beautifully, when evolutionary growth and wisdom development support each other harmoniously? That's Node sextile Chiron during extended communication processing.","This aspect creates harmonious flow between your soul's evolutionary path and your healing abilities, while the extended Gemini void Moon gives you time to understand how to communicate these insights effectively."
"July 11, 2026 - Communication Healing","Gemini Moon reminds us that healing wisdom serves most when shared through diverse connections. Today, let communication multiply healing.","Moon in Gemini continues after extended void, creating versatile, connecting energy perfect for communicating healing wisdom through multiple channels and diverse networking approaches.","Integration","Moon in Gemini continues","• Share healing insights through various communication channels - writing, speaking, teaching, connecting | • Create networks and connections that support both learning and healing work | • Use versatile communication approaches to make healing wisdom accessible to diverse audiences | • Connect with people who appreciate both intellectual stimulation and healing service | • Trust that varied communication serves healing wisdom better than single-channel approaches","2026-07-11","You know those days when your healing insights want to be shared through various communication methods - writing, speaking, teaching, connecting - when your wisdom naturally flows into helpful conversations? That's Gemini Moon supporting your Node-Chiron harmony with versatile communication.","This is perfect energy for sharing your healing wisdom through diverse communication channels, creating multiple connections that serve both learning and healing, and networking in ways that support collective growth."
"July 12, 2026 - Nurturing Communication","Extended Cancer void Moons are cosmic nurseries for communication wisdom. Today, let caring organize your healing voice.","Extended Void Moon in Cancer (5:11 PM today - 12:46 PM tomorrow) - your inner nurturer gets extended processing time to organize how healing communication can create emotional security and family-oriented connection.","Void","Extended Void Moon in Cancer begins (5:11 PM)","• During void period (5:11 PM today - 12:46 PM tomorrow), avoid making major emotional or family decisions | • Use this time to feel into how your healing communication can serve emotional security and nurturing connection | • Consider how diverse networking can support family-oriented values and caring relationships | • Let your heart guide what communication approaches truly create emotional safety | • After void, implement communication that serves both learning and nurturing","2026-07-12","You know those times when you want your healing communication and networking to serve emotional security and nurturing connection rather than just intellectual stimulation? That's what this extended Cancer void Moon supports. Your voice is learning to nurture.","This extended void Moon creates beautiful space for understanding how your healing communication and diverse connections can serve emotional security, family wellbeing, and nurturing support for yourself and others."
"July 13, 2026 - Caring Communication Integration","Extended Cancer processing during communication development ensures wisdom serves caring. Today, let love guide your voice.","Extended Void Moon in Cancer continues until 12:46 PM - continued nurturing processing of healing communication, ensuring diverse networking serves emotional intelligence and caring connection.","Integration","Extended Void Moon in Cancer continues (until 12:46 PM)","• Continue void period until 12:46 PM - perfect time for emotional communication processing | • Use this time for practices that connect intellectual abilities with emotional intelligence | • Consider how healing wisdom can be communicated in ways that create emotional security | • After void, implement communication approaches that serve both learning and caring | • Trust that emotionally intelligent communication is more healing than just clever networking","2026-07-13","You know those extended periods when you need unstructured emotional processing time to understand how your intellectual and healing abilities can serve genuine caring and family-oriented support? That's what this continued Cancer void Moon provides.","This continued void Moon provides additional space for integrating healing communication with emotional intelligence, ensuring your diverse networking and wisdom sharing serve genuine nurturing and caring connection."
"July 14, 2026 - Nurturing Fresh Start","New Moons in Cancer with Leo support create emotional security through creative confidence. Today, let caring become creative leadership.","New Moon in Cancer at 5:43 AM + brief Void Moon in Leo (4:43 AM - 5:35 PM) - cosmic fresh start in the nurturing zone during creative processing. Your emotional intelligence gets new beginning support.","Activation","New Moon in Cancer (5:43 AM), Brief Void Moon in Leo (4:43 AM - 5:35 PM)","• Set intentions around creating emotional security, nurturing communication, and caring service | • During void period (4:43 AM - 5:35 PM), avoid making major creative or visibility commitments | • Focus on fresh starts that combine emotional intelligence with abundant leadership abilities | • After void, begin implementing nurturing approaches that also express creative confidence | • Trust that this nurturing fresh start has creative leadership support for authentic expression","2026-07-14","You know that feeling when you're ready for a fresh start in how you create emotional security, nurture others, and express caring wisdom, when your family-oriented values want to begin a new chapter? That's New Moon in Cancer with creative confidence support.","This New Moon is downloading new programming for emotional security, nurturing communication, family connection, and caring service. The Leo void Moon gives your creative confidence time to understand how to support these nurturing fresh starts."
"July 15, 2026 - Revolutionary Inspiration","Uranus sextile Neptune reminds us that the most powerful innovations serve spiritual evolution. Today, let inspiration revolutionize your communication.","Uranus sextile Neptune at 4:36 PM - the cosmic revolutionary harmoniously connects with the spiritual visionary. It's like your communication innovations and spiritual insights are working together to create inspired breakthroughs.","Activation","Uranus sextile Neptune (4:36 PM)","• Trust breakthrough ideas that combine revolutionary communication with spiritual wisdom | • Use innovative approaches to share spiritual insights and healing wisdom | • Focus on technological or communication innovations that serve spiritual and emotional development | • Connect with people who appreciate both cutting-edge thinking and spiritual depth | • Let spiritual inspiration guide your revolutionary communication and networking innovations","2026-07-15","You know that feeling when your revolutionary communication abilities and spiritual insights suddenly work together beautifully, when innovation and inspiration create breakthrough possibilities? That's Uranus sextile Neptune. Your cutting-edge ideas get spiritual blessing.","This aspect creates harmonious flow between your revolutionary communication abilities and spiritual vision, enabling breakthrough innovations that serve both technological advancement and spiritual evolution."
"July 16, 2026 - Service Innovation","Virgo Moon reminds us that the most powerful innovations become useful service to others. Today, let analysis perfect your revolutionary insights.","Brief Void Moon in Virgo (5:26 PM yesterday - 7:07 PM today), then Moon in Virgo - extended service processing concludes, followed by analytical refinement. Your revolutionary inspiration wants practical application.","Integration","Brief Void Moon in Virgo continues (until 7:07 PM), Moon in Virgo","• Brief void period ends at 7:07 PM - most of day available for refinement work | • Organize breakthrough insights from yesterday into practical, helpful applications | • Refine revolutionary communication approaches to better serve others' genuine needs | • Use analytical abilities to perfect spiritual innovations and healing communication | • Focus on service applications of your breakthrough ideas that create lasting positive change","2026-07-16","You know that feeling when breakthrough innovations suddenly want to be refined and organized into practical, helpful applications that serve others? That's Virgo Moon arriving after Uranus-Neptune inspiration. Your revolutionary insights want to become useful service.","Today brings perfect energy for refining your revolutionary communication and spiritual innovations into practical applications that genuinely help others and serve meaningful purposes."
"July 17, 2026 - Detailed Excellence","Clear Virgo days are cosmic workshops for perfecting revolutionary service. Today, your attention to detail serves breakthrough innovation.","Moon in Virgo continues with no major planetary aspects - pure analytical, service-oriented energy perfect for continued refinement of revolutionary communication and spiritual innovation applications.","Integration","Moon in Virgo continues - detailed excellence day","• Perfect the details of breakthrough applications that serve healing communication and spiritual innovation | • Improve service systems to better support revolutionary approaches to connection and healing | • Use analytical abilities to solve practical problems in implementing innovative spiritual insights | • Focus on meaningful work that combines cutting-edge thinking with devoted service | • Trust that attention to service details creates lasting positive change in communication and spiritual development","2026-07-17","You know those days when you feel naturally drawn to perfect the practical details of meaningful breakthrough work, when improving service applications feels both satisfying and genuinely helpful? That's clear Virgo Moon helping you perfect revolutionary innovation.","This is premium time for focused work on refining, improving, and perfecting the practical applications of your revolutionary communication insights and spiritual innovations."
"July 18, 2026 - Revolutionary Transformation","Uranus trine Pluto reminds us that the most powerful revolutions serve collective evolution. Today, your innovation becomes evolutionary service.","Uranus trine Pluto at 12:43 AM + brief Void Moon in Libra (5:13 PM - 11:56 PM) - revolutionary innovation harmoniously supports collective transformation during balance processing. Change meets evolution beautifully.","Transformation","Uranus trine Pluto (12:43 AM), Brief Void Moon in Libra (5:13 PM - 11:56 PM)","• Trust revolutionary changes that align with authentic collective transformation needs | • During void period (5:13 PM - 11:56 PM), process collaborative applications but avoid major partnership commitments | • Focus on innovations that serve both individual authenticity and collective evolution | • Use revolutionary communication to support positive transformation in communities and relationships | • Apply breakthrough insights in ways that serve both innovation and collaborative harmony","2026-07-18","You know that feeling when your revolutionary communication abilities suddenly align perfectly with deep collective transformation needs, when innovation and evolution work together effortlessly? That's Uranus trine Pluto during collaborative processing.","This is one of the most powerful aspects for implementing revolutionary changes that serve authentic collective transformation. Your communication innovations get maximum support from evolutionary forces."
